response_id,text,timestamp,demographics
1,"AI is amazing technology that will revolutionize healthcare and help doctors save more lives",2024-01-15 10:30:00,age:25-34;education:graduate
2,"I'm really worried about AI taking away jobs from hardworking people like my family",2024-01-15 11:45:00,age:45-54;education:high_school
3,"Machine learning algorithms are powerful tools for analyzing complex patterns in data",2024-01-15 14:20:00,age:35-44;education:graduate
4,"The AI overlords will eventually control humanity unless we create proper regulations now",2024-01-15 16:10:00,age:25-34;education:college
5,"Humans and AI should work together as partners to solve climate change and global problems",2024-01-15 18:30:00,age:18-24;education:college
6,"AI systems are evolving rapidly in this digital ecosystem of technological innovation",2024-01-16 09:15:00,age:35-44;education:graduate
7,"We must defend against the AI invasion that threatens traditional industries and values",2024-01-16 12:40:00,age:55-64;education:high_school
8,"Artificial intelligence is like a brilliant brain that processes information faster than humans",2024-01-16 15:20:00,age:25-34;education:college
9,"AI tools help doctors diagnose diseases more accurately and provide better patient care",2024-01-16 17:50:00,age:45-54;education:graduate
10,"The mysterious black box of AI decision-making raises serious concerns about transparency",2024-01-17 10:10:00,age:35-44;education:graduate